Dataset,Theme,Categories,SubCategories,URL,Date_of_check
"Singapore's Balance Of Payments, (BPM6 Format)",Economy & Prices,Balance of Payments (BOP),Singapore's Balance of Payments (BOP),https://tablebuilder.singstat.gov.sg/table/TS/M060171,17/03/2024 20:28:35
"Singapore's Balance Of Payments, Additional Details Of The Current Account",Economy & Prices,Balance of Payments (BOP),Singapore's Balance of Payments (BOP),https://tablebuilder.singstat.gov.sg/table/TS/M060301,17/03/2024 20:28:35
"Singapore's Balance Of Payments, Additional Details Of The Financial Account",Economy & Prices,Balance of Payments (BOP),Singapore's Balance of Payments (BOP),https://tablebuilder.singstat.gov.sg/table/TS/M060191,17/03/2024 20:28:35
Singapore's Inward Direct Investment Flows By Broad Industry,Economy & Prices,Balance of Payments (BOP),Singapore's Inward Direct Investment Flows,https://tablebuilder.singstat.gov.sg/table/TS/M085771,17/03/2024 20:28:35
Singapore's Inward Direct Investment Flows By Component,Economy & Prices,Balance of Payments (BOP),Singapore's Inward Direct Investment Flows,https://tablebuilder.singstat.gov.sg/table/TS/M085801,17/03/2024 20:28:35
Singapore's Inward Direct Investment Flows By Source Economy,Economy & Prices,Balance of Payments (BOP),Singapore's Inward Direct Investment Flows,https://tablebuilder.singstat.gov.sg/table/TS/M085761,17/03/2024 20:28:35
Singapore's Inward Direct Investment Flows By Source Economy And Broad Industry,Economy & Prices,Balance of Payments (BOP),Singapore's Inward Direct Investment Flows,https://tablebuilder.singstat.gov.sg/table/TS/M085811,17/03/2024 20:28:35
Singapore's Inward Direct Investment Flows By Source Economy And Component,Economy & Prices,Balance of Payments (BOP),Singapore's Inward Direct Investment Flows,https://tablebuilder.singstat.gov.sg/table/TS/M085821,17/03/2024 20:28:35
"Singapore External Debt Statistics, (End Of Period)",Economy & Prices,External Debt,Singapore's External Debt,https://tablebuilder.singstat.gov.sg/table/TS/M060221,17/03/2024 20:28:35
Household Sector Balance Sheet (End Of Period),Economy & Prices,Household Sector Balance Sheet,"Household Net Worth, Assets and Liabilities",https://tablebuilder.singstat.gov.sg/table/TS/M700981,17/03/2024 20:28:35
"Singapore International Investment Position, (End Of Period)",Economy & Prices,International Investment Position (IIP),Singapore's International Investment Position (IIP),https://tablebuilder.singstat.gov.sg/table/TS/M060241,17/03/2024 20:28:35
"Singapore's Portfolio Investment Assets By Destination Economy And Instrument, (End Of Period)",Economy & Prices,International Investment Position (IIP),Singapore's Portfolio Investment Assets,https://tablebuilder.singstat.gov.sg/table/TS/M060281,17/03/2024 20:28:35
"Singapore's Portfolio Investment Liabilities By Source Economy And Instrument, (End Of Period)",Economy & Prices,International Investment Position (IIP),Singapore’s Portfolio Investment Liabilities,https://tablebuilder.singstat.gov.sg/table/TS/M060321,17/03/2024 20:28:35
Active Central Provident Fund Members By Age Group (End Of Period),Economy & Prices,"Labour, Employment, Wages and Productivity",CPF Members and Employers,https://tablebuilder.singstat.gov.sg/table/TS/M180221,17/03/2024 20:28:35
Active Central Provident Fund Members By Industry (End Of Period),Economy & Prices,"Labour, Employment, Wages and Productivity",CPF Members and Employers,https://tablebuilder.singstat.gov.sg/table/TS/M183381,17/03/2024 20:28:35
Central Provident Fund Members By Age Group (End Of Period),Economy & Prices,"Labour, Employment, Wages and Productivity",CPF Members and Employers,https://tablebuilder.singstat.gov.sg/table/TS/M180241,17/03/2024 20:28:35
Number Of Active Employers,Economy & Prices,"Labour, Employment, Wages and Productivity",CPF Members and Employers,https://tablebuilder.singstat.gov.sg/table/TS/M183621,17/03/2024 20:28:35
"Changes In Employment By Sector, (Compared To The Previous Period)",Economy & Prices,"Labour, Employment, Wages and Productivity",Employment,https://tablebuilder.singstat.gov.sg/table/TS/M183891,17/03/2024 20:28:35
"Employed Female Residents Aged 15 Years And Over By Industry And Age Group, (June)",Economy & Prices,"Labour, Employment, Wages and Productivity",Employment,https://tablebuilder.singstat.gov.sg/table/TS/M182151,17/03/2024 20:28:35
"Employed Female Residents Aged 15 Years And Over By Occupation And Age Group, (June)",Economy & Prices,"Labour, Employment, Wages and Productivity",Employment,https://tablebuilder.singstat.gov.sg/table/TS/M182191,17/03/2024 20:28:35
"Employed Male Residents Aged 15 Years And Over By Industry And Age Group, (June)",Economy & Prices,"Labour, Employment, Wages and Productivity",Employment,https://tablebuilder.singstat.gov.sg/table/TS/M182141,17/03/2024 20:28:35
"Employed Male Residents Aged 15 Years And Over By Occupation And Age Group, (June)",Economy & Prices,"Labour, Employment, Wages and Productivity",Employment,https://tablebuilder.singstat.gov.sg/table/TS/M182181,17/03/2024 20:28:35
"Employed Residents Aged 15 Years And Over By Industry And Age Group, (June)",Economy & Prices,"Labour, Employment, Wages and Productivity",Employment,https://tablebuilder.singstat.gov.sg/table/TS/M182131,17/03/2024 20:28:35
"Employed Residents Aged 15 Years And Over By Industry And Occupation, (June)",Economy & Prices,"Labour, Employment, Wages and Productivity",Employment,https://tablebuilder.singstat.gov.sg/table/TS/M182081,17/03/2024 20:28:35
"Employed Residents Aged 15 Years And Over By Occupation And Age Group, (June)",Economy & Prices,"Labour, Employment, Wages and Productivity",Employment,https://tablebuilder.singstat.gov.sg/table/TS/M182171,17/03/2024 20:28:35
"Employment (Persons) By Sector, (As At Year-End)",Economy & Prices,"Labour, Employment, Wages and Productivity",Employment,https://tablebuilder.singstat.gov.sg/table/TS/M182841,17/03/2024 20:28:35
Employment Services (Year-To-Date),Economy & Prices,"Labour, Employment, Wages and Productivity",Employment,https://tablebuilder.singstat.gov.sg/table/TS/M183321,17/03/2024 20:28:35
Labour Market Statistics,Economy & Prices,"Labour, Employment, Wages and Productivity",Employment,https://tablebuilder.singstat.gov.sg/table/TS/M183111,17/03/2024 20:28:35
Labour Market Statistics (End Of Period),Economy & Prices,"Labour, Employment, Wages and Productivity",Employment,https://tablebuilder.singstat.gov.sg/table/TS/M181641,17/03/2024 20:28:35
"Number Of Employers By Sex, End June",Economy & Prices,"Labour, Employment, Wages and Productivity",Employment,https://tablebuilder.singstat.gov.sg/table/TS/M920161,17/03/2024 20:28:35
"Number Of Full-Time Employed Residents By Sex, End June",Economy & Prices,"Labour, Employment, Wages and Productivity",Employment,https://tablebuilder.singstat.gov.sg/table/TS/M920141,17/03/2024 20:28:35
"Number Of Part-Time Employed Residents By Sex, End June",Economy & Prices,"Labour, Employment, Wages and Productivity",Employment,https://tablebuilder.singstat.gov.sg/table/TS/M920151,17/03/2024 20:28:35
Re-Entry Into Employment Rate,Economy & Prices,"Labour, Employment, Wages and Productivity",Employment,https://tablebuilder.singstat.gov.sg/table/TS/M181571,17/03/2024 20:28:35
Job Vacancies By Industry And Occupational Group (SSIC 2020) (End Of Period),Economy & Prices,"Labour, Employment, Wages and Productivity",Job Vacancies,https://tablebuilder.singstat.gov.sg/table/TS/M184071,17/03/2024 20:28:35
"Female Residents Aged 15 Years And Over By Labour Force Status And Age Group, End June",Economy & Prices,"Labour, Employment, Wages and Productivity",Labour Force,https://tablebuilder.singstat.gov.sg/table/TS/M182111,17/03/2024 20:28:35
"Female Residents Labour Force Aged 15 Years And Over By Age And Highest Qualification Attained, End June",Economy & Prices,"Labour, Employment, Wages and Productivity",Labour Force,https://tablebuilder.singstat.gov.sg/table/TS/M183681,17/03/2024 20:28:35
"Labour Force Aged 15 Years And Over, End June",Economy & Prices,"Labour, Employment, Wages and Productivity",Labour Force,https://tablebuilder.singstat.gov.sg/table/TS/M182331,17/03/2024 20:28:35
"Male Residents Aged 15 Years And Over By Labour Force Status And Age Group, End June",Economy & Prices,"Labour, Employment, Wages and Productivity",Labour Force,https://tablebuilder.singstat.gov.sg/table/TS/M182101,17/03/2024 20:28:35
"Male Residents Labour Force Aged 15 Years And Over By Age And Highest Qualification Attained, End June",Economy & Prices,"Labour, Employment, Wages and Productivity",Labour Force,https://tablebuilder.singstat.gov.sg/table/TS/M183671,17/03/2024 20:28:35
"Number Of Married Residents In Labour Force Aged 15 Years And Over By Sex, End June",Economy & Prices,"Labour, Employment, Wages and Productivity",Labour Force,https://tablebuilder.singstat.gov.sg/table/TS/M920171,17/03/2024 20:28:35
"Resident Labour Force Aged 15 Years And Over By Highest Qualification Attained And Sex, End June",Economy & Prices,"Labour, Employment, Wages and Productivity",Labour Force,https://tablebuilder.singstat.gov.sg/table/TS/M182271,17/03/2024 20:28:35
"Resident Labour Force Participation Rate Aged 15 Years And Over By Age And Sex, End June",Economy & Prices,"Labour, Employment, Wages and Productivity",Labour Force,https://tablebuilder.singstat.gov.sg/table/TS/M182201,17/03/2024 20:28:35
"Total Residents Aged 15 Years And Over By Labour Force Status And Age Group, End June",Economy & Prices,"Labour, Employment, Wages and Productivity",Labour Force,https://tablebuilder.singstat.gov.sg/table/TS/M182091,17/03/2024 20:28:35
"Total Residents Labour Force Aged 15 Years And Over By Age And Highest Qualification Attained, End June",Economy & Prices,"Labour, Employment, Wages and Productivity",Labour Force,https://tablebuilder.singstat.gov.sg/table/TS/M183661,17/03/2024 20:28:35
Usual Hours Worked Per Week And Percentage Of Workers Who Worked At Least 40 Hours Per Week,Economy & Prices,"Labour, Employment, Wages and Productivity",Labour Force,https://tablebuilder.singstat.gov.sg/table/TS/M184091,17/03/2024 20:28:35
Trade Disputes Filed With Ministry Of Manpower,Economy & Prices,"Labour, Employment, Wages and Productivity",Labour Relations,https://tablebuilder.singstat.gov.sg/table/TS/M180091,17/03/2024 20:28:35
Trade Disputes Filed With The Industrial Arbitration Court,Economy & Prices,"Labour, Employment, Wages and Productivity",Labour Relations,https://tablebuilder.singstat.gov.sg/table/TS/M183651,17/03/2024 20:28:35
"Trade Unions And Membership, (At End Of Period)",Economy & Prices,"Labour, Employment, Wages and Productivity",Labour Relations,https://tablebuilder.singstat.gov.sg/table/TS/M180081,17/03/2024 20:28:35
Changes In Value Added Per Actual Hour Worked In Chained (2015) Dollars By Industry,Economy & Prices,"Labour, Employment, Wages and Productivity",Productivity,https://tablebuilder.singstat.gov.sg/table/TS/M015861,17/03/2024 20:28:35
"Changes In Value Added Per Worker At Current Prices, By Industry (SSIC 2020)",Economy & Prices,"Labour, Employment, Wages and Productivity",Productivity,https://tablebuilder.singstat.gov.sg/table/TS/M015821,17/03/2024 20:28:35
"Changes In Value Added Per Worker In Chained (2015) Dollars, By Industry (SSIC 2020)",Economy & Prices,"Labour, Employment, Wages and Productivity",Productivity,https://tablebuilder.singstat.gov.sg/table/TS/M015701,17/03/2024 20:28:35
Multifactor Productivity: Contributions To Growth In Real GDP,Economy & Prices,"Labour, Employment, Wages and Productivity",Productivity,https://tablebuilder.singstat.gov.sg/table/TS/M014981,17/03/2024 20:28:35
Value Added Per Actual Hour Worked In Chained (2015) Dollars By Industry,Economy & Prices,"Labour, Employment, Wages and Productivity",Productivity,https://tablebuilder.singstat.gov.sg/table/TS/M015871,17/03/2024 20:28:35
"Value Added Per Worker At Current Prices, By Industry (SSIC 2020)",Economy & Prices,"Labour, Employment, Wages and Productivity",Productivity,https://tablebuilder.singstat.gov.sg/table/TS/M015801,17/03/2024 20:28:35
"Value Added Per Worker In Chained (2015) Dollars, By Industry (SSIC 2020)",Economy & Prices,"Labour, Employment, Wages and Productivity",Productivity,https://tablebuilder.singstat.gov.sg/table/TS/M015691,17/03/2024 20:28:35
"Average Monthly Recruitment Rate By Industry And Occupational Group, (SSIC 2020)",Economy & Prices,"Labour, Employment, Wages and Productivity",Recruitment and Resignation Rate,https://tablebuilder.singstat.gov.sg/table/TS/M184021,17/03/2024 20:28:35
"Average Monthly Resignation Rate By Industry And Occupational Group, (SSIC 2020)",Economy & Prices,"Labour, Employment, Wages and Productivity",Recruitment and Resignation Rate,https://tablebuilder.singstat.gov.sg/table/TS/M184031,17/03/2024 20:28:35
Retrenched Employees By Industry (SSIC 2020) And Occupational Group,Economy & Prices,"Labour, Employment, Wages and Productivity",Redundancy,https://tablebuilder.singstat.gov.sg/table/TS/M183911,17/03/2024 20:28:35
Retrenched Permanent Employees By Industry (SSIC 2020) And Occupational Group,Economy & Prices,"Labour, Employment, Wages and Productivity",Redundancy,https://tablebuilder.singstat.gov.sg/table/TS/M183881,17/03/2024 20:28:35
Retrenched Term Contract Employees By Industry (SSIC 2020) And Occupational Group,Economy & Prices,"Labour, Employment, Wages and Productivity",Redundancy,https://tablebuilder.singstat.gov.sg/table/TS/M183921,17/03/2024 20:28:35
"Singapore Workforce Skills Qualifications (WSQ) Trainees By Age, Highest Qualification Attained, And Sex",Economy & Prices,"Labour, Employment, Wages and Productivity",Training,https://tablebuilder.singstat.gov.sg/table/TS/M183091,17/03/2024 20:28:35
Singapore Workforce Skills Qualifications (WSQ) Trainees By Level Of WSQ Statement Of Attainment,Economy & Prices,"Labour, Employment, Wages and Productivity",Training,https://tablebuilder.singstat.gov.sg/table/TS/M183101,17/03/2024 20:28:35
"Average Resident Unemployment Rate By Sex, Age And Highest Qualification Attained",Economy & Prices,"Labour, Employment, Wages and Productivity",Unemployment,https://tablebuilder.singstat.gov.sg/table/TS/M183401,17/03/2024 20:28:35
"Unemployed Residents Aged 15 Years And Over By Sex, (June)",Economy & Prices,"Labour, Employment, Wages and Productivity",Unemployment,https://tablebuilder.singstat.gov.sg/table/TS/M184081,17/03/2024 20:28:35
Unemployment Rate (End Of Period),Economy & Prices,"Labour, Employment, Wages and Productivity",Unemployment,https://tablebuilder.singstat.gov.sg/table/TS/M182341,17/03/2024 20:28:35
"Unemployment Rate Aged 15 Years And Over, End June",Economy & Prices,"Labour, Employment, Wages and Productivity",Unemployment,https://tablebuilder.singstat.gov.sg/table/TS/M182332,17/03/2024 20:28:35
Unit Labour Cost Index (2015 = 100),Economy & Prices,"Labour, Employment, Wages and Productivity",Unit Labour Cost (ULC),https://tablebuilder.singstat.gov.sg/table/TS/M183741,17/03/2024 20:28:35
Average Monthly Nominal Earnings Per Employee,Economy & Prices,"Labour, Employment, Wages and Productivity",Wages and Income from Employment,https://tablebuilder.singstat.gov.sg/table/TS/M182931,17/03/2024 20:28:35
Average Weekly Paid Hours Worked Per Employee By Industry,Economy & Prices,"Labour, Employment, Wages and Productivity",Wages and Income from Employment,https://tablebuilder.singstat.gov.sg/table/TS/M184061,17/03/2024 20:28:35
"Changes In Average Monthly Nominal Earnings Per Employee, (Compared To The Same Period A Year Ago)",Economy & Prices,"Labour, Employment, Wages and Productivity",Wages and Income from Employment,https://tablebuilder.singstat.gov.sg/table/TS/M182561,17/03/2024 20:28:35
Gross Monthly Income From Employment (Including Employer CPF) Of Full-Time Employed Residents,Economy & Prices,"Labour, Employment, Wages and Productivity",Wages and Income from Employment,https://tablebuilder.singstat.gov.sg/table/TS/M182981,17/03/2024 20:28:35
"Median Gross Monthly Income From Employment (Including Employer CPF) Of Full-Time Employed Residents By Occupations And Sex, End June",Economy & Prices,"Labour, Employment, Wages and Productivity",Wages and Income from Employment,https://tablebuilder.singstat.gov.sg/table/TS/M920131,17/03/2024 20:28:35
Composite Leading Index (2015 = 100),Economy & Prices,Leading Indicators,Composite Leading Index (CLI),https://tablebuilder.singstat.gov.sg/table/TS/M240421,17/03/2024 20:28:35
Consumption Of Fixed Capital At Current Prices,Economy & Prices,National Accounts,Capital Stock,https://tablebuilder.singstat.gov.sg/table/TS/M015591,17/03/2024 20:28:35
Consumption Of Fixed Capital In Chained (2015) Dollars,Economy & Prices,National Accounts,Capital Stock,https://tablebuilder.singstat.gov.sg/table/TS/M015581,17/03/2024 20:28:35
Gross Capital Stock At Current Prices By Type Of Assets,Economy & Prices,National Accounts,Capital Stock,https://tablebuilder.singstat.gov.sg/table/TS/M015071,17/03/2024 20:28:35
Gross Capital Stock In Chained (2015) Dollars By Type Of Assets,Economy & Prices,National Accounts,Capital Stock,https://tablebuilder.singstat.gov.sg/table/TS/M014991,17/03/2024 20:28:35
Net Capital Stock At Current Prices By Type Of Assets,Economy & Prices,National Accounts,Capital Stock,https://tablebuilder.singstat.gov.sg/table/TS/M015081,17/03/2024 20:28:35
Net Capital Stock In Chained (2015) Dollars By Type Of Assets,Economy & Prices,National Accounts,Capital Stock,https://tablebuilder.singstat.gov.sg/table/TS/M015001,17/03/2024 20:28:35
Compensation Of Employees By Industry At Current Prices,Economy & Prices,National Accounts,Compensation of Employees,https://tablebuilder.singstat.gov.sg/table/TS/M015971,17/03/2024 20:28:35
Expenditure On Gross Domestic Product At Current Prices,Economy & Prices,National Accounts,Expenditure on Gross Domestic Product (GDP),https://tablebuilder.singstat.gov.sg/table/TS/M014871,17/03/2024 20:28:35
Expenditure On Gross Domestic Product Deflators (2015 = 100),Economy & Prices,National Accounts,Expenditure on Gross Domestic Product (GDP),https://tablebuilder.singstat.gov.sg/table/TS/M015111,17/03/2024 20:28:35
Expenditure On Gross Domestic Product In Chained (2015) Dollars,Economy & Prices,National Accounts,Expenditure on Gross Domestic Product (GDP),https://tablebuilder.singstat.gov.sg/table/TS/M014811,17/03/2024 20:28:35
Share Of Expenditure On Gross Domestic Product At Current Prices,Economy & Prices,National Accounts,Expenditure on Gross Domestic Product (GDP),https://tablebuilder.singstat.gov.sg/table/TS/M015531,17/03/2024 20:28:35
Individual And Collective Government Consumption Expenditure At Current Prices,Economy & Prices,National Accounts,Government Consumption Expenditure,https://tablebuilder.singstat.gov.sg/table/TS/M016121,17/03/2024 20:28:35
"Contribution To Growth In Gross Domestic Product In Chained (2015) Dollars, By Industry (SSIC 2020)",Economy & Prices,National Accounts,Gross Domestic Product (GDP),https://tablebuilder.singstat.gov.sg/table/TS/M015671,17/03/2024 20:28:35
"Gross Domestic Product At Current Prices, By Industry (SSIC 2020)",Economy & Prices,National Accounts,Gross Domestic Product (GDP),https://tablebuilder.singstat.gov.sg/table/TS/M015651,17/03/2024 20:28:35
"Gross Domestic Product Deflators (2015 = 100), By Industry (SSIC 2020)",Economy & Prices,National Accounts,Gross Domestic Product (GDP),https://tablebuilder.singstat.gov.sg/table/TS/M015681,17/03/2024 20:28:35
"Gross Domestic Product In Chained (2015) Dollars, By Industry (SSIC 2020)",Economy & Prices,National Accounts,Gross Domestic Product (GDP),https://tablebuilder.singstat.gov.sg/table/TS/M015661,17/03/2024 20:28:35
"Gross Domestic Product, Year On Year Growth Rate",Economy & Prices,National Accounts,Gross Domestic Product (GDP),https://tablebuilder.singstat.gov.sg/table/TS/M015631,17/03/2024 20:28:35
Income Components Of Gross Domestic Product At Current Prices,Economy & Prices,National Accounts,Gross Domestic Product (GDP),https://tablebuilder.singstat.gov.sg/table/TS/M015961,17/03/2024 20:28:35
"Key Data Of Gross Domestic Product In Chained (2015) Dollars, By Industry (SSIC 2020)",Economy & Prices,National Accounts,Gross Domestic Product (GDP),https://tablebuilder.singstat.gov.sg/table/TS/M015941,17/03/2024 20:28:35
"Key Data Of Gross Domestic Product In Chained (2015) Dollars, By Industry (SSIC 2020), Year On Year Growth Rate",Economy & Prices,National Accounts,Gross Domestic Product (GDP),https://tablebuilder.singstat.gov.sg/table/TS/M015911,17/03/2024 20:28:35
Per Capita GDP In Chained (2015) Dollars,Economy & Prices,National Accounts,Gross Domestic Product (GDP),https://tablebuilder.singstat.gov.sg/table/TS/M015891,17/03/2024 20:28:35
Per Capita GNI And Per Capita GDP At Current Prices,Economy & Prices,National Accounts,Gross Domestic Product (GDP),https://tablebuilder.singstat.gov.sg/table/TS/M015121,17/03/2024 20:28:35
Share Of Income Components Of Gross Domestic Product At Current Prices,Economy & Prices,National Accounts,Gross Domestic Product (GDP),https://tablebuilder.singstat.gov.sg/table/TS/M016071,17/03/2024 20:28:35
"Share Of Nominal Gross Value Added, By Industry (SSIC 2020)",Economy & Prices,National Accounts,Gross Domestic Product (GDP),https://tablebuilder.singstat.gov.sg/table/TS/M015781,17/03/2024 20:28:35
Gross Fixed Capital Formation At Current Prices,Economy & Prices,National Accounts,Gross Fixed Capital Formation (GFCF),https://tablebuilder.singstat.gov.sg/table/TS/M014891,17/03/2024 20:28:35
Gross Fixed Capital Formation In Chained (2015) Dollars,Economy & Prices,National Accounts,Gross Fixed Capital Formation (GFCF),https://tablebuilder.singstat.gov.sg/table/TS/M014841,17/03/2024 20:28:35
Gross Operating Surplus By Industry At Current Prices,Economy & Prices,National Accounts,Gross Operating Surplus,https://tablebuilder.singstat.gov.sg/table/TS/M015981,17/03/2024 20:28:35
Generation Of Income Account At Current Prices,Economy & Prices,National Accounts,Gross Value Added (GVA) by Institutional Sector,https://tablebuilder.singstat.gov.sg/table/TS/M016091,17/03/2024 20:28:35
Production Account At Current Prices,Economy & Prices,National Accounts,Gross Value Added (GVA) by Institutional Sector,https://tablebuilder.singstat.gov.sg/table/TS/M016101,17/03/2024 20:28:35
Other Taxes Less Subsidies On Production By Industry At Current Prices,Economy & Prices,National Accounts,Other Taxes Less Subsidies on Production,https://tablebuilder.singstat.gov.sg/table/TS/M015991,17/03/2024 20:28:35
"Output, Saving & Investment At Current Prices",Economy & Prices,National Accounts,"Output, Saving and Investment",https://tablebuilder.singstat.gov.sg/table/TS/M015031,17/03/2024 20:28:35
"Output, Saving & Investment At Current Prices In USD",Economy & Prices,National Accounts,"Output, Saving and Investment",https://tablebuilder.singstat.gov.sg/table/TS/M015101,17/03/2024 20:28:35
Personal Disposable Income At Current Prices,Economy & Prices,National Accounts,Personal Disposable Income and Personal Saving,https://tablebuilder.singstat.gov.sg/table/TS/M016081,17/03/2024 20:28:35
Private Consumption Expenditure At Current Prices,Economy & Prices,National Accounts,Private Consumption Expenditure,https://tablebuilder.singstat.gov.sg/table/TS/M015041,17/03/2024 20:28:35
Private Consumption Expenditure In Chained (2015) Dollars,Economy & Prices,National Accounts,Private Consumption Expenditure,https://tablebuilder.singstat.gov.sg/table/TS/M014951,17/03/2024 20:28:35
Direct Requirement Coefficients,Economy & Prices,National Accounts,"Supply, Use and Input-Output Tables (SUT and IOT)",https://tablebuilder.singstat.gov.sg/table/CT/17847,17/03/2024 20:28:35
Domestic Supply Table,Economy & Prices,National Accounts,"Supply, Use and Input-Output Tables (SUT and IOT)",https://tablebuilder.singstat.gov.sg/table/CT/16350,17/03/2024 20:28:35
Domestic Use Table At Basic Prices,Economy & Prices,National Accounts,"Supply, Use and Input-Output Tables (SUT and IOT)",https://tablebuilder.singstat.gov.sg/table/CT/17834,17/03/2024 20:28:35
Forward And Backward Linkages,Economy & Prices,National Accounts,"Supply, Use and Input-Output Tables (SUT and IOT)",https://tablebuilder.singstat.gov.sg/table/CT/17841,17/03/2024 20:28:35
Import Requirement Coefficients,Economy & Prices,National Accounts,"Supply, Use and Input-Output Tables (SUT and IOT)",https://tablebuilder.singstat.gov.sg/table/CT/16359,17/03/2024 20:28:35
Import Use Table At Basic Prices,Economy & Prices,National Accounts,"Supply, Use and Input-Output Tables (SUT and IOT)",https://tablebuilder.singstat.gov.sg/table/CT/17835,17/03/2024 20:28:35
"Imports, Taxes On Products And Primary Inputs By Final Demand",Economy & Prices,National Accounts,"Supply, Use and Input-Output Tables (SUT and IOT)",https://tablebuilder.singstat.gov.sg/table/CT/17145,17/03/2024 20:28:35
"Industrial Output By Imports, Taxes On Products And Primary Inputs In Coefficient Form",Economy & Prices,National Accounts,"Supply, Use and Input-Output Tables (SUT and IOT)",https://tablebuilder.singstat.gov.sg/table/CT/16358,17/03/2024 20:28:35
Industrial Value Added At Basic Prices By Final Expenditure,Economy & Prices,National Accounts,"Supply, Use and Input-Output Tables (SUT and IOT)",https://tablebuilder.singstat.gov.sg/table/CT/16360,17/03/2024 20:28:35
Industry By Industry Flow Matrix,Economy & Prices,National Accounts,"Supply, Use and Input-Output Tables (SUT and IOT)",https://tablebuilder.singstat.gov.sg/table/CT/17688,17/03/2024 20:28:35
Industry By Industry Input-Output Table,Economy & Prices,National Accounts,"Supply, Use and Input-Output Tables (SUT and IOT)",https://tablebuilder.singstat.gov.sg/table/CT/17836,17/03/2024 20:28:35
