Dataset,Theme,Categories,SubCategories,URL,Date_of_check
Divorces Under The Administration Of Muslim Law Act By Duration Of Marriage And Number Of Children Under 18 And 21 Years,Population,"Marital Status, Marriages and Divorces",Divorces under the Administration of Muslim Law Act,https://tablebuilder.singstat.gov.sg/table/TS/M830238,17/03/2024 20:28:35
"Divorces Under The Administration Of Muslim Law Act By Age Group And Sex Of Divorcees, And Duration Of Marriage",Population,"Marital Status, Marriages and Divorces",Divorces under the Administration of Muslim Law Act,https://tablebuilder.singstat.gov.sg/table/TS/M830239,17/03/2024 20:28:35
Divorces Under The Administration Of Muslim Law Act By (A) Duration Of Marriage; (B) Plaintiff; And Main Reason For Divorce,Population,"Marital Status, Marriages and Divorces",Divorces under the Administration of Muslim Law Act,https://tablebuilder.singstat.gov.sg/table/TS/M830240,17/03/2024 20:28:35
Divorces Under The Administration Of Muslim Law Act By Main Reason For Divorce And Ethnic Group Of Couple,Population,"Marital Status, Marriages and Divorces",Divorces under the Administration of Muslim Law Act,https://tablebuilder.singstat.gov.sg/table/TS/M830241,17/03/2024 20:28:35
"Divorces Under The Administration Of Muslim Law Act By Age Group And Sex Of Divorcees, And Main Reason For Divorce",Population,"Marital Status, Marriages and Divorces",Divorces under the Administration of Muslim Law Act,https://tablebuilder.singstat.gov.sg/table/TS/M830242,17/03/2024 20:28:35
Annulments Under The Women's Charter By Age Group And Sex,Population,"Marital Status, Marriages and Divorces",Annulments under the Women's Charter,https://tablebuilder.singstat.gov.sg/table/TS/M830243,17/03/2024 20:28:35
Annulments Under The Women's Charter By Duration Of Marriage,Population,"Marital Status, Marriages and Divorces",Annulments under the Women's Charter,https://tablebuilder.singstat.gov.sg/table/TS/M830244,17/03/2024 20:28:35
Annulments Under The Women's Charter By Ethnic Group Of Couple,Population,"Marital Status, Marriages and Divorces",Annulments under the Women's Charter,https://tablebuilder.singstat.gov.sg/table/TS/M830245,17/03/2024 20:28:35
"Annulments Under The Women's Charter By Ethnic Group Of Couple, January - December",Population,"Marital Status, Marriages and Divorces",Annulments under the Women's Charter,https://tablebuilder.singstat.gov.sg/table/TS/M830246,17/03/2024 20:28:35
Annulments Under The Women's Charter By Age Group Of Husbands And Wives,Population,"Marital Status, Marriages and Divorces",Annulments under the Women's Charter,https://tablebuilder.singstat.gov.sg/table/TS/M830247,17/03/2024 20:28:35
"Annulments Under The Women's Charter By Duration Of Marriage, Age Group And Sex",Population,"Marital Status, Marriages and Divorces",Annulments under the Women's Charter,https://tablebuilder.singstat.gov.sg/table/TS/M830248,17/03/2024 20:28:35
Annulments Under The Women's Charter By Previous Marital Status Of Husbands And Wives,Population,"Marital Status, Marriages and Divorces",Annulments under the Women's Charter,https://tablebuilder.singstat.gov.sg/table/TS/M830249,17/03/2024 20:28:35
Cumulative Proportion Of Dissolved Resident Marriages By Marriage Cohort At Selected Marriage Anniversary,Population,"Marital Status, Marriages and Divorces",Dissolution of Marriages Among Resident Marriage Cohorts,https://tablebuilder.singstat.gov.sg/table/TS/M830301,17/03/2024 20:28:35
Resident Population Aged 15 Years & Over By Sex And Marital Status,Population,"Marital Status, Marriages and Divorces",Marital Status,https://tablebuilder.singstat.gov.sg/table/TS/M810601,17/03/2024 20:28:35
"Singapore Residents Aged 20 Years & Over By Sex, Age Group And Marital Status",Population,"Marital Status, Marriages and Divorces",Marital Status,https://tablebuilder.singstat.gov.sg/table/TS/M810641,17/03/2024 20:28:35
Proportion Of Singles Among Resident Population By Selected Age Group And Sex,Population,"Marital Status, Marriages and Divorces",Proportion of Singles,https://tablebuilder.singstat.gov.sg/table/TS/M810581,17/03/2024 20:28:35
"Proportion Of Singles Among Resident Population By Selected Age Group, Sex And Highest Qualification Attained",Population,"Marital Status, Marriages and Divorces",Proportion of Singles,https://tablebuilder.singstat.gov.sg/table/TS/M810591,17/03/2024 20:28:35
Proportion Of Singles Among Citizen Population By Selected Age Group And Sex,Population,"Marital Status, Marriages and Divorces",Proportion of Singles,https://tablebuilder.singstat.gov.sg/table/TS/M810681,17/03/2024 20:28:35
"Proportion Of Singles Among Citizen Population By Selected Age Group, Sex And Highest Qualification Attained",Population,"Marital Status, Marriages and Divorces",Proportion of Singles,https://tablebuilder.singstat.gov.sg/table/TS/M810691,17/03/2024 20:28:35
Resident Population Aged 15 Years and Over Born In Singapore,Population,"Marital Status, Marriages and Divorces",Census of Population and General Household Survey,https://tablebuilder.singstat.gov.sg/table/CT/17658,17/03/2024 20:28:35
Resident Population Aged 15 Years and Over,Population,"Marital Status, Marriages and Divorces",Census of Population and General Household Survey,https://tablebuilder.singstat.gov.sg/table/CT/17465,17/03/2024 20:28:35
Resident Ever-Married Females Aged 15 Years and Over,Population,"Marital Status, Marriages and Divorces",Census of Population and General Household Survey,https://tablebuilder.singstat.gov.sg/table/CT/8867,17/03/2024 20:28:35
Resident Population Aged 15 Years and Over Born Outside Singapore,Population,"Marital Status, Marriages and Divorces",Census of Population and General Household Survey,https://tablebuilder.singstat.gov.sg/table/CT/17659,17/03/2024 20:28:35
Births And Fertility Rates,Population,Births and Fertility,"Births, Crude Birth Rate (CBR), Total Fertility Rate (TFR) and Reproduction Rates",https://tablebuilder.singstat.gov.sg/table/TS/M810091,17/03/2024 20:28:35
Live-Births By Birth Order,Population,Births and Fertility,"Births, Crude Birth Rate (CBR), Total Fertility Rate (TFR) and Reproduction Rates",https://tablebuilder.singstat.gov.sg/table/TS/M810071,17/03/2024 20:28:35
Live-Births By Sex And Ethnic Group,Population,Births and Fertility,"Births, Crude Birth Rate (CBR), Total Fertility Rate (TFR) and Reproduction Rates",https://tablebuilder.singstat.gov.sg/table/TS/M810051,17/03/2024 20:28:35
Live-Births By Place Of Occurrence,Population,Births and Fertility,"Births, Crude Birth Rate (CBR), Total Fertility Rate (TFR) and Reproduction Rates",https://tablebuilder.singstat.gov.sg/table/TS/M810061,17/03/2024 20:28:35
Median Age Of Mothers At First Birth For Resident Births,Population,Births and Fertility,"Births, Crude Birth Rate (CBR), Total Fertility Rate (TFR) and Reproduction Rates",https://tablebuilder.singstat.gov.sg/table/TS/M810741,17/03/2024 20:28:35
Resident Ever-Married Females By Age Group And Number Of Children Born,Population,Births and Fertility,"Births, Crude Birth Rate (CBR), Total Fertility Rate (TFR) and Reproduction Rates",https://tablebuilder.singstat.gov.sg/table/TS/M810571,17/03/2024 20:28:35
Average Number Of Children Born By Age Group Of Resident Ever-Married Females,Population,Births and Fertility,"Births, Crude Birth Rate (CBR), Total Fertility Rate (TFR) and Reproduction Rates",https://tablebuilder.singstat.gov.sg/table/TS/M810411,17/03/2024 20:28:35
Average Number Of Children Born To Resident Ever-Married Females Aged 40-49 Years By Highest Qualification Attained,Population,Births and Fertility,"Births, Crude Birth Rate (CBR), Total Fertility Rate (TFR) and Reproduction Rates",https://tablebuilder.singstat.gov.sg/table/TS/M810421,17/03/2024 20:28:35
Citizen Ever-Married Females By Age Group And Number Of Children Born,Population,Births and Fertility,"Births, Crude Birth Rate (CBR), Total Fertility Rate (TFR) and Reproduction Rates",https://tablebuilder.singstat.gov.sg/table/TS/M810721,17/03/2024 20:28:35
Average Number Of Children Born By Age Group Of Citizen Ever-Married Females,Population,Births and Fertility,"Births, Crude Birth Rate (CBR), Total Fertility Rate (TFR) and Reproduction Rates",https://tablebuilder.singstat.gov.sg/table/TS/M810701,17/03/2024 20:28:35
Resident Ever-Married Females Aged 15 Years and Over,Population,Births and Fertility,Census of Population and General Household Survey,https://tablebuilder.singstat.gov.sg/table/CT/17410,17/03/2024 20:28:35
Death And Death Rates,Population,Death and Life Expectancy,"Deaths, Death Rates and Mortality",https://tablebuilder.singstat.gov.sg/table/TS/M810481,17/03/2024 20:28:35
Age-Specific Death Rates,Population,Death and Life Expectancy,"Deaths, Death Rates and Mortality",https://tablebuilder.singstat.gov.sg/table/TS/M810141,17/03/2024 20:28:35
Deaths By Ethnic Group And Sex,Population,Death and Life Expectancy,"Deaths, Death Rates and Mortality",https://tablebuilder.singstat.gov.sg/table/TS/M810121,17/03/2024 20:28:35
Infant Deaths By Ethnic Group And Sex,Population,Death and Life Expectancy,"Deaths, Death Rates and Mortality",https://tablebuilder.singstat.gov.sg/table/TS/M810111,17/03/2024 20:28:35
Deaths By Broad Groups Of Causes,Population,Death and Life Expectancy,"Deaths, Death Rates and Mortality",https://tablebuilder.singstat.gov.sg/table/TS/M810131,17/03/2024 20:28:35
Death By Types Of Mortality,Population,Death and Life Expectancy,"Deaths, Death Rates and Mortality",https://tablebuilder.singstat.gov.sg/table/TS/M920251,17/03/2024 20:28:35
Life Expectancy By Sex,Population,Death and Life Expectancy,Life Expectancy,https://tablebuilder.singstat.gov.sg/table/TS/M810501,17/03/2024 20:28:35
"Singapore Residents Aged 25 Years & Over By Highest Qualification Attained, Sex And Age Group",Population,"Education, Language Spoken and Literacy",Highest Qualification Attained (HQA),https://tablebuilder.singstat.gov.sg/table/TS/M850581,17/03/2024 20:28:35
Education Profile Of Singapore Residents Aged 25 Years & Over By Selected Highest Qualification Attained (%),Population,"Education, Language Spoken and Literacy",Highest Qualification Attained (HQA),https://tablebuilder.singstat.gov.sg/table/TS/M850701,17/03/2024 20:28:35
Mean Years Of Schooling,Population,"Education, Language Spoken and Literacy",Mean Years of Schooling,https://tablebuilder.singstat.gov.sg/table/TS/M850591,17/03/2024 20:28:35
Indicators On Education And Literacy,Population,"Education, Language Spoken and Literacy",Key Literacy and Proficiency Indicators,https://tablebuilder.singstat.gov.sg/table/TS/M850001,17/03/2024 20:28:35
Proportion Of Students Achieving At Least A Minimum Proficiency In Reading And Mathematics By Level And Sex,Population,"Education, Language Spoken and Literacy",Key Literacy and Proficiency Indicators,https://tablebuilder.singstat.gov.sg/table/TS/M850671,17/03/2024 20:28:35
Resident Population Aged 5 Years and Over,Population,"Education, Language Spoken and Literacy",Census of Population and General Household Survey,https://tablebuilder.singstat.gov.sg/table/CT/17446,17/03/2024 20:28:35
Resident Students Aged 5 Years and Over,Population,"Education, Language Spoken and Literacy",Census of Population and General Household Survey,https://tablebuilder.singstat.gov.sg/table/CT/17457,17/03/2024 20:28:35
Resident Population Aged 15 Years and Over,Population,"Education, Language Spoken and Literacy",Census of Population and General Household Survey,https://tablebuilder.singstat.gov.sg/table/CT/17452,17/03/2024 20:28:35
Resident Students Aged 10 Years and Over,Population,"Education, Language Spoken and Literacy",Census of Population and General Household Survey,https://tablebuilder.singstat.gov.sg/table/CT/6557,17/03/2024 20:28:35
Resident Students Aged 15 Years and Over,Population,"Education, Language Spoken and Literacy",Census of Population and General Household Survey,https://tablebuilder.singstat.gov.sg/table/CT/17433,17/03/2024 20:28:35
Resident Polytechnic Diploma Graduates Aged 15 Years and Over,Population,"Education, Language Spoken and Literacy",Census of Population and General Household Survey,https://tablebuilder.singstat.gov.sg/table/CT/17423,17/03/2024 20:28:35
Resident University Graduates Aged 15 Years and Over,Population,"Education, Language Spoken and Literacy",Census of Population and General Household Survey,https://tablebuilder.singstat.gov.sg/table/CT/17424,17/03/2024 20:28:35
Resident Population Aged 15 Years and Over With Below Polytechnic Qualification,Population,"Education, Language Spoken and Literacy",Census of Population and General Household Survey,https://tablebuilder.singstat.gov.sg/table/CT/8691,17/03/2024 20:28:35
Resident Population Aged 15 Years and Over With Below Polytechnic Qualification Who Acquired Vocational Qualification,Population,"Education, Language Spoken and Literacy",Census of Population and General Household Survey,https://tablebuilder.singstat.gov.sg/table/CT/8693,17/03/2024 20:28:35
Resident Population Aged 5 Years and Over Born Outside Singapore,Population,"Education, Language Spoken and Literacy",Census of Population and General Household Survey,https://tablebuilder.singstat.gov.sg/table/CT/5955,17/03/2024 20:28:35
Resident Population Aged 15 Years and Over Born Outside Singapore,Population,"Education, Language Spoken and Literacy",Census of Population and General Household Survey,https://tablebuilder.singstat.gov.sg/table/CT/8889,17/03/2024 20:28:35
"Combined And Gross Enrolment Ratio For Primary, Secondary & Tertiary Education",Population,"Education, Language Spoken and Literacy",Enrolment,https://tablebuilder.singstat.gov.sg/table/TS/M850681,17/03/2024 20:28:35
Enrolment In Arts Institution By Course And Level,Population,"Education, Language Spoken and Literacy",Enrolment,https://tablebuilder.singstat.gov.sg/table/TS/M850611,17/03/2024 20:28:35
Enrolment In Educational Institutions,Population,"Education, Language Spoken and Literacy",Enrolment,https://tablebuilder.singstat.gov.sg/table/TS/M850251,17/03/2024 20:28:35
Enrolment In Government And Government-Aided Primary Schools By Level And Age,Population,"Education, Language Spoken and Literacy",Enrolment,https://tablebuilder.singstat.gov.sg/table/TS/M850411,17/03/2024 20:28:35
"Enrolment In Government, Government-Aided, Independent, Specialised Independent And Specialised Secondary Schools And Junior Colleges By Level And Age",Population,"Education, Language Spoken and Literacy",Enrolment,https://tablebuilder.singstat.gov.sg/table/TS/M850241,17/03/2024 20:28:35
Enrolment In Higher Degree Courses By Type Of Course,Population,"Education, Language Spoken and Literacy",Enrolment,https://tablebuilder.singstat.gov.sg/table/TS/M850531,17/03/2024 20:28:35
Enrolment In Polytechnic Advanced Diploma Courses By Type Of Course,Population,"Education, Language Spoken and Literacy",Enrolment,https://tablebuilder.singstat.gov.sg/table/TS/M850521,17/03/2024 20:28:35
Enrolment In Polytechnic Diploma Courses By Type Of Course And Sex,Population,"Education, Language Spoken and Literacy",Enrolment,https://tablebuilder.singstat.gov.sg/table/TS/M850481,17/03/2024 20:28:35
Enrolment In University First Degree Courses By Type Of Course And Sex,Population,"Education, Language Spoken and Literacy",Enrolment,https://tablebuilder.singstat.gov.sg/table/TS/M850491,17/03/2024 20:28:35
Number Of Full-Time Polytechnic Students Enrolment By Sex,Population,"Education, Language Spoken and Literacy",Enrolment,https://tablebuilder.singstat.gov.sg/table/TS/M850741,17/03/2024 20:28:35
Number Of Full-Time University Students Enrolment By Sex,Population,"Education, Language Spoken and Literacy",Enrolment,https://tablebuilder.singstat.gov.sg/table/TS/M850771,17/03/2024 20:28:35
"Total Net Enrolment Rate, Gender Parity Index, And Pupil-Teacher Ratio For Primary And Secondary Education",Population,"Education, Language Spoken and Literacy",Enrolment,https://tablebuilder.singstat.gov.sg/table/TS/M850691,17/03/2024 20:28:35
Graduates From Arts Institution By Course And Level,Population,"Education, Language Spoken and Literacy",Graduates,https://tablebuilder.singstat.gov.sg/table/TS/M850621,17/03/2024 20:28:35
Graduates From Higher Degree Courses By Type Of Course,Population,"Education, Language Spoken and Literacy",Graduates,https://tablebuilder.singstat.gov.sg/table/TS/M850551,17/03/2024 20:28:35
Graduates From Polytechnic Advanced Diploma Courses By Type Of Course,Population,"Education, Language Spoken and Literacy",Graduates,https://tablebuilder.singstat.gov.sg/table/TS/M850541,17/03/2024 20:28:35
Graduates From Polytechnic Diploma Courses By Type Of Course And Sex,Population,"Education, Language Spoken and Literacy",Graduates,https://tablebuilder.singstat.gov.sg/table/TS/M850501,17/03/2024 20:28:35
Graduates From University First Degree Courses By Type Of Course And Sex,Population,"Education, Language Spoken and Literacy",Graduates,https://tablebuilder.singstat.gov.sg/table/TS/M850511,17/03/2024 20:28:35
Number Of Full-Time ITE Students Graduates By Sex,Population,"Education, Language Spoken and Literacy",Graduates,https://tablebuilder.singstat.gov.sg/table/TS/M850721,17/03/2024 20:28:35
Number Of Full-Time Polytechnic Students Graduates By Sex,Population,"Education, Language Spoken and Literacy",Graduates,https://tablebuilder.singstat.gov.sg/table/TS/M850751,17/03/2024 20:28:35
Number Of Full-Time University Graduates By Sex,Population,"Education, Language Spoken and Literacy",Graduates,https://tablebuilder.singstat.gov.sg/table/TS/M850781,17/03/2024 20:28:35
Number Of Full-Time ITE Students Intake By Sex,Population,"Education, Language Spoken and Literacy",Intake,https://tablebuilder.singstat.gov.sg/table/TS/M850711,17/03/2024 20:28:35
Number Of Full-Time Polytechnic Students Intake By Sex,Population,"Education, Language Spoken and Literacy",Intake,https://tablebuilder.singstat.gov.sg/table/TS/M850731,17/03/2024 20:28:35
Number Of Full-Time University Students Intake By Sex,Population,"Education, Language Spoken and Literacy",Intake,https://tablebuilder.singstat.gov.sg/table/TS/M850761,17/03/2024 20:28:35
Gross Intake Ratio To The Last Grade Of Primary Education And Lower Secondary General Education,Population,"Education, Language Spoken and Literacy",School Stage Completion or Graduation Rate,https://tablebuilder.singstat.gov.sg/table/TS/M920041,17/03/2024 20:28:35
Percentage Of A-Level Students With At Least 3 H2 Passes And Pass In General Paper Or Knowledge And Inquiry,Population,"Education, Language Spoken and Literacy",School Stage Completion or Graduation Rate,https://tablebuilder.singstat.gov.sg/table/TS/M920231,17/03/2024 20:28:35
Percentage Of N-Level Students Who Progressed To Post-Secondary Education,Population,"Education, Language Spoken and Literacy",School Stage Completion or Graduation Rate,https://tablebuilder.singstat.gov.sg/table/TS/M920211,17/03/2024 20:28:35
Percentage Of O-Level Students Who Progressed To Post-Secondary Education,Population,"Education, Language Spoken and Literacy",School Stage Completion or Graduation Rate,https://tablebuilder.singstat.gov.sg/table/TS/M920221,17/03/2024 20:28:35
Percentage Of P1 Cohort Eligible For Secondary School,Population,"Education, Language Spoken and Literacy",School Stage Completion or Graduation Rate,https://tablebuilder.singstat.gov.sg/table/TS/M920191,17/03/2024 20:28:35
Percentage Of P1 Cohort That Progressed To Post-Secondary Education,Population,"Education, Language Spoken and Literacy",School Stage Completion or Graduation Rate,https://tablebuilder.singstat.gov.sg/table/TS/M920201,17/03/2024 20:28:35
"Number Of Principals By Level, School Type And Sex",Population,"Education, Language Spoken and Literacy","Schools, Students and Education Officers",https://tablebuilder.singstat.gov.sg/table/TS/M850661,17/03/2024 20:28:35
Number Of Schools By Level And Type,Population,"Education, Language Spoken and Literacy","Schools, Students and Education Officers",https://tablebuilder.singstat.gov.sg/table/TS/M850631,17/03/2024 20:28:35
"Number Of Teachers By Level, School Type And Sex",Population,"Education, Language Spoken and Literacy","Schools, Students and Education Officers",https://tablebuilder.singstat.gov.sg/table/TS/M850641,17/03/2024 20:28:35
"Number Of Vice-Principals By Level, School Type And Sex",Population,"Education, Language Spoken and Literacy","Schools, Students and Education Officers",https://tablebuilder.singstat.gov.sg/table/TS/M850651,17/03/2024 20:28:35
Principals,Population,"Education, Language Spoken and Literacy","Schools, Students and Education Officers",https://tablebuilder.singstat.gov.sg/table/TS/M850601,17/03/2024 20:28:35
Students And Teachers In Educational Institutions,Population,"Education, Language Spoken and Literacy","Schools, Students and Education Officers",https://tablebuilder.singstat.gov.sg/table/TS/M850261,17/03/2024 20:28:35
Intake Of Students/Trainees Under The Full-Time Institutional Training And Traineeship Programmes And Students/Trainees Who Completed The Programmes,Population,"Education, Language Spoken and Literacy",Training,https://tablebuilder.singstat.gov.sg/table/TS/M850561,17/03/2024 20:28:35
Training Places Taken Up Under The Skills Training And Continuing Academic Education Programmes And Persons Who Completed The Programmes,Population,"Education, Language Spoken and Literacy",Training,https://tablebuilder.singstat.gov.sg/table/TS/M850571,17/03/2024 20:28:35
Government Expenditure On Education,Population,"Education, Language Spoken and Literacy",Government Expenditure on Education,https://tablebuilder.singstat.gov.sg/table/TS/M850011,17/03/2024 20:28:35
Government Recurrent Expenditure On Education Per Student,Population,"Education, Language Spoken and Literacy",Government Expenditure on Education,https://tablebuilder.singstat.gov.sg/table/TS/M850291,17/03/2024 20:28:35
Resident Population Aged 15 Years and Over,Population,Religion,Census of Population and General Household Survey,https://tablebuilder.singstat.gov.sg/table/CT/17458,17/03/2024 20:28:35
Resident Population Aged 15 Years and Over Born Outside Singapore,Population,Religion,Census of Population and General Household Survey,https://tablebuilder.singstat.gov.sg/table/CT/6361,17/03/2024 20:28:35
Resident Students Aged 5 Years and Over,Population,Mode of Transport,Census of Population and General Household Survey,https://tablebuilder.singstat.gov.sg/table/CT/17598,17/03/2024 20:28:35
Employed Residents Aged 15 Years and Over,Population,Mode of Transport,Census of Population and General Household Survey,https://tablebuilder.singstat.gov.sg/table/CT/17614,17/03/2024 20:28:35
Resident Working Persons Aged 15 Years and Over,Population,Mode of Transport,Census of Population and General Household Survey,https://tablebuilder.singstat.gov.sg/table/CT/8347,17/03/2024 20:28:35
Resident Population Aged 5 Years and Over,Population,Difficulty Performing Basic Activities,Census of Population,https://tablebuilder.singstat.gov.sg/table/CT/17615,17/03/2024 20:28:35
Resident Students Aged 5 Years and Over,Population,Difficulty Performing Basic Activities,Census of Population,https://tablebuilder.singstat.gov.sg/table/CT/17621,17/03/2024 20:28:35
Resident Employed Persons Aged 15 Years and Over,Population,Difficulty Performing Basic Activities,Census of Population,https://tablebuilder.singstat.gov.sg/table/CT/17629,17/03/2024 20:28:35
Resident Population Aged 15 Years and Over,Population,Difficulty Performing Basic Activities,Census of Population,https://tablebuilder.singstat.gov.sg/table/CT/17625,17/03/2024 20:28:35
Resident Households,Population,Difficulty Performing Basic Activities,Census of Population,https://tablebuilder.singstat.gov.sg/table/CT/17655,17/03/2024 20:28:35
Resident Population Aged 65 Years and Over in Resident Households,Population,Difficulty Performing Basic Activities,Census of Population,https://tablebuilder.singstat.gov.sg/table/CT/17619,17/03/2024 20:28:35
Key Indicators On The Elderly,Population,"Elderly, Youth and Gender Profile",Elderly,https://tablebuilder.singstat.gov.sg/table/TS/M810611,17/03/2024 20:28:35
Resident Population Aged 65 Years and Over in Resident Households,Population,"Elderly, Youth and Gender Profile",Census of Population and General Household Survey,https://tablebuilder.singstat.gov.sg/table/CT/8296,17/03/2024 20:28:35
Key Indicators On The Youth,Population,"Elderly, Youth and Gender Profile",Youth,https://tablebuilder.singstat.gov.sg/table/TS/M810621,17/03/2024 20:28:35
Key Indicators On Gender,Population,"Elderly, Youth and Gender Profile",Gender,https://tablebuilder.singstat.gov.sg/table/TS/M810631,17/03/2024 20:28:35
Average Monthly Household Expenditure Among Resident Households,Households,Household Expenditure,Household Expenditure Survey,https://tablebuilder.singstat.gov.sg/table/CT/16631,17/03/2024 20:28:35
Average Monthly Household Expenditure Among Resident Households By Type Of Goods And Services,Households,Household Expenditure,Household Expenditure Survey,https://tablebuilder.singstat.gov.sg/table/TS/M212981,17/03/2024 20:28:35
Average Monthly Household Expenditure Among Resident Households Comprising Solely Non-Working Persons Aged 65 Years and Over,Households,Household Expenditure,Household Expenditure Survey,https://tablebuilder.singstat.gov.sg/table/CT/16524,17/03/2024 20:28:35
Average Monthly Household Expenditure Per Household Member Among Resident Households,Households,Household Expenditure,Household Expenditure Survey,https://tablebuilder.singstat.gov.sg/table/CT/16450,17/03/2024 20:28:35
Average Monthly Household Expenditure Per Household Member Among Resident Households Comprising Solely Non-Working Persons Aged 65 Years and Over,Households,Household Expenditure,Household Expenditure Survey,https://tablebuilder.singstat.gov.sg/table/CT/16516,17/03/2024 20:28:35
